{
  "context_cost_schema_version": "1.0.0",
  "record_id": "TASK-018-PHASE-G-FINAL-PILOT-CONTEXT-20260814-01",
  "task_id": "TASK-018",
  "session_id": "codex-phase-g-post-w2-20260814-root-01",
  "phase": "PHASE_G_POST_W2_CONVERSATION_FREE_RESTART",
  "recorded_at": "2026-08-13T17:34:25.239Z",
  "confidence": "CHARACTER_HEURISTIC",
  "sources": [
    {
      "source_id": "os-current-state",
      "source_type": "CANONICAL_FILE",
      "path_or_ref": "registry/current-state.md",
      "sha256": "sha256:06b89d06fa27417c767f54d61f13210f6c5ef37af9f0e72a0c71221a1be32626",
      "estimated_tokens": 3217,
      "observed_tokens": null,
      "selected_reason": "Owner-required current OS route and authority",
      "mandatory": true,
      "cacheable": true,
      "changed_since_previous_session": true,
      "used_in_decision": true,
      "used_in_patch": true,
      "duplicate_of": null,
      "stale": false,
      "trust_level": "CURRENT_CANONICAL_OS_HEAD_F3617DA"
    },
    {
      "source_id": "os-ai-context-pack",
      "source_type": "CANONICAL_FILE",
      "path_or_ref": "registry/ai-context-pack.md",
      "sha256": "sha256:3187fd738f48646d8afafc86bbea44c8ff0849b065dcfe08d0c6ad274cedbf37",
      "estimated_tokens": 2467,
      "observed_tokens": null,
      "selected_reason": "Owner-required current loading and claim boundary",
      "mandatory": true,
      "cacheable": true,
      "changed_since_previous_session": true,
      "used_in_decision": true,
      "used_in_patch": true,
      "duplicate_of": null,
      "stale": false,
      "trust_level": "CURRENT_CANONICAL_OS_HEAD_F3617DA"
    },
    {
      "source_id": "os-post-w2-restart-bootstrap",
      "source_type": "RESTART_BOOTSTRAP",
      "path_or_ref": "tasks/TASK-018/phase-g-post-w2-conversation-free-restart-bootstrap-2026-08-14.md",
      "sha256": "sha256:e019bd8b59b64291dc3ad4959c181073890dacfa9055875f44f493b9bb136ec5",
      "estimated_tokens": 839,
      "observed_tokens": null,
      "selected_reason": "Exact post-W2 independent restart contract",
      "mandatory": true,
      "cacheable": true,
      "changed_since_previous_session": true,
      "used_in_decision": true,
      "used_in_patch": true,
      "duplicate_of": null,
      "stale": false,
      "trust_level": "CURRENT_TASK018_P0"
    },
    {
      "source_id": "consumer-current-state",
      "source_type": "CONSUMER_CANONICAL_FILE",
      "path_or_ref": "BAI_VIDEO_PRODUCTION:docs/ai-team/current-state.md",
      "sha256": "sha256:42ba1f77d310102e4eebe54155d266e7e88f3523d3a9209bb35632cdb7729b3c",
      "estimated_tokens": 3284,
      "observed_tokens": null,
      "selected_reason": "Current Consumer release and TASK-036 boundary",
      "mandatory": true,
      "cacheable": true,
      "changed_since_previous_session": true,
      "used_in_decision": true,
      "used_in_patch": true,
      "duplicate_of": null,
      "stale": false,
      "trust_level": "CONSUMER_HEAD_B30DA22"
    },
    {
      "source_id": "consumer-w0-w1-parking-decision",
      "source_type": "CONSUMER_TASK_RECORD",
      "path_or_ref": "BAI_VIDEO_PRODUCTION:docs/ai-team/tasks/TASK-036/phase-g-w0-w1-parking-decision-2026-08-14.md",
      "sha256": "sha256:77225d46d4ab077605f726b93fff5ef4a4917b55a18a7566338769cf9624bfa7",
      "estimated_tokens": 849,
      "observed_tokens": null,
      "selected_reason": "Exact partial and parked W0/W1 boundary",
      "mandatory": true,
      "cacheable": true,
      "changed_since_previous_session": true,
      "used_in_decision": true,
      "used_in_patch": true,
      "duplicate_of": null,
      "stale": false,
      "trust_level": "CONSUMER_HEAD_B30DA22"
    },
    {
      "source_id": "consumer-w2-runtime-report",
      "source_type": "CONSUMER_TASK_RECORD",
      "path_or_ref": "BAI_VIDEO_PRODUCTION:docs/ai-team/tasks/TASK-036/phase-g-w2-runtime-binding-report.md",
      "sha256": "sha256:dcf5035ee7ffa6a3e3453647b35be3262cabc38f4f9ab57592345f629094e993",
      "estimated_tokens": 1232,
      "observed_tokens": null,
      "selected_reason": "Exact packaged native W2 implementation and PASS boundary",
      "mandatory": true,
      "cacheable": true,
      "changed_since_previous_session": false,
      "used_in_decision": true,
      "used_in_patch": true,
      "duplicate_of": null,
      "stale": false,
      "trust_level": "CONSUMER_HEAD_B30DA22"
    }
  ],
  "usage": {
    "estimated_input_tokens": 11888,
    "observed_input_tokens": null,
    "observed_cached_input_tokens": null,
    "observed_output_tokens": null,
    "billed_tokens": null
  },
  "quality_gate": {
    "status": "PASS",
    "gate_id": "PHASE_G_POST_W2_CONVERSATION_FREE_RESTART_PASS"
  },
  "efficiency": {
    "status": "AVAILABLE",
    "score": 100,
    "formula": "useful_ratio*(1-duplicate_ratio)*(1-stale_ratio)*100"
  },
  "metrics": {
    "source_count": 6,
    "estimated_input_tokens": 11888,
    "duplicate_tokens": 0,
    "stale_tokens": 0,
    "useful_tokens": 11888,
    "avoidable_tokens": 0,
    "duplicate_ratio": 0,
    "stale_ratio": 0,
    "useful_ratio": 1,
    "avoidable_ratio": 0
  },
  "overfetch_policy": {
    "warning_ratio": 0.1,
    "major_ratio": 0.25,
    "critical_ratio": 0.5,
    "critical_repeat_count": 2
  },
  "repeated_overfetch_count": 0,
  "findings": [],
  "content_checksum": "sha256:23e1b63e5b4af17d6a25e855926ecbc73376ceecfa3bb9657c74de58bed403b6"
}
