{
  "context_cost_schema_version": "1.0.0",
  "record_id": "TASK-018-PHASE-G-PILOT-CHECKPOINT-20260813-01",
  "task_id": "TASK-018",
  "session_id": "codex-phase-g-20260813-root-01",
  "phase": "PHASE_G_M3A_NATIVE_CHECKPOINT",
  "recorded_at": "2026-08-13T12:21:00.000Z",
  "confidence": "CHARACTER_HEURISTIC",
  "sources": [
    {
      "source_id": "os-phase-g-context-baseline",
      "source_type": "CONTEXT_COST_RECORD",
      "path_or_ref": "tasks/TASK-018/phase-g-context-cost-baseline-2026-08-13.json",
      "sha256": "sha256:773820a2da57883fc4944f7ead77b5e48301d4ee9e800d61d30cc00a8ab0af39",
      "estimated_tokens": 4105,
      "observed_tokens": null,
      "selected_reason": "Phase G bootstrap comparison baseline",
      "mandatory": true,
      "cacheable": true,
      "changed_since_previous_session": false,
      "used_in_decision": true,
      "used_in_patch": true,
      "duplicate_of": null,
      "stale": false,
      "trust_level": "CURRENT_CHECKOUT"
    },
    {
      "source_id": "os-context-cost-specification",
      "source_type": "CANONICAL_FILE",
      "path_or_ref": "specifications/BAI_Development_OS_Context_Cost_Specification_Ver1.0.md",
      "sha256": "sha256:d96e43d1b750c6982c62771b3232ae480738845532a6a136457adc6838aa338e",
      "estimated_tokens": 552,
      "observed_tokens": null,
      "selected_reason": "Measurement and reporting contract",
      "mandatory": true,
      "cacheable": true,
      "changed_since_previous_session": false,
      "used_in_decision": true,
      "used_in_patch": true,
      "duplicate_of": null,
      "stale": false,
      "trust_level": "CURRENT_CANONICAL"
    },
    {
      "source_id": "consumer-project",
      "source_type": "CONSUMER_CANONICAL_FILE",
      "path_or_ref": "BAI_VIDEO_PRODUCTION:PROJECT.md",
      "sha256": "sha256:98a3078b670b10153cadd97a324b46e0a9d1fc1437ab17f900039015d28d11ab",
      "estimated_tokens": 4026,
      "observed_tokens": null,
      "selected_reason": "Consumer authority and current product boundary",
      "mandatory": true,
      "cacheable": true,
      "changed_since_previous_session": true,
      "used_in_decision": true,
      "used_in_patch": false,
      "duplicate_of": null,
      "stale": false,
      "trust_level": "CONSUMER_MAIN_0861D863"
    },
    {
      "source_id": "consumer-current-state",
      "source_type": "CONSUMER_CANONICAL_FILE",
      "path_or_ref": "BAI_VIDEO_PRODUCTION:docs/ai-team/current-state.md",
      "sha256": "sha256:fe4b189c2272174eb6c90e6794100e71ad01753d77db13e651e4ffce6b9c0e44",
      "estimated_tokens": 3131,
      "observed_tokens": null,
      "selected_reason": "Current Phase G route and formal release boundary",
      "mandatory": true,
      "cacheable": true,
      "changed_since_previous_session": true,
      "used_in_decision": true,
      "used_in_patch": true,
      "duplicate_of": null,
      "stale": false,
      "trust_level": "CONSUMER_MAIN_0861D863"
    },
    {
      "source_id": "consumer-roadmap-ver-1-12",
      "source_type": "CONSUMER_CANONICAL_FILE",
      "path_or_ref": "BAI_VIDEO_PRODUCTION:docs/roadmap/PROJECT-ROADMAP-CANONICAL.md",
      "sha256": "sha256:187fc990012dfc6d7275b4b28ba220a977b523ab7b1aafd3ac7bac52e055754e",
      "estimated_tokens": 8790,
      "observed_tokens": null,
      "selected_reason": "Canonical M3A/M3B and Phase G continuation order",
      "mandatory": true,
      "cacheable": true,
      "changed_since_previous_session": true,
      "used_in_decision": true,
      "used_in_patch": true,
      "duplicate_of": null,
      "stale": false,
      "trust_level": "CONSUMER_MAIN_0861D863"
    },
    {
      "source_id": "consumer-task036-acceptance-report",
      "source_type": "CONSUMER_TASK_RECORD",
      "path_or_ref": "BAI_VIDEO_PRODUCTION:docs/ai-team/tasks/TASK-036/phase-g-native-acceptance-report.md",
      "sha256": "sha256:e279e21bb1149eb363d2d5adcd1f2c31beb3c2c7b26c55c5dfe3706075514c50",
      "estimated_tokens": 478,
      "observed_tokens": null,
      "selected_reason": "Exact W0/W1/W2 completion boundary",
      "mandatory": true,
      "cacheable": true,
      "changed_since_previous_session": true,
      "used_in_decision": true,
      "used_in_patch": true,
      "duplicate_of": null,
      "stale": false,
      "trust_level": "CONSUMER_MAIN_0861D863"
    },
    {
      "source_id": "consumer-task010-native-evidence",
      "source_type": "CONSUMER_NATIVE_EVIDENCE",
      "path_or_ref": "BAI_VIDEO_PRODUCTION:evidence/native/phase-g-task010-fix-20260813-04/task010-native-gate.json",
      "sha256": "sha256:4d7c9bfb1a80fe9f3d0d2f85d4a40310304008b12f5e3dc5bfa8ec74ce2e7e35",
      "estimated_tokens": 1532,
      "observed_tokens": null,
      "selected_reason": "Real Resolve assembly gate result",
      "mandatory": true,
      "cacheable": true,
      "changed_since_previous_session": true,
      "used_in_decision": true,
      "used_in_patch": false,
      "duplicate_of": null,
      "stale": false,
      "trust_level": "NATIVE_EVIDENCE"
    },
    {
      "source_id": "consumer-task011-native-evidence",
      "source_type": "CONSUMER_NATIVE_EVIDENCE",
      "path_or_ref": "BAI_VIDEO_PRODUCTION:evidence/native/phase-g-task011-20260813-04/task011-native-render-qa.json",
      "sha256": "sha256:72613c247cbe874693e204e1ba125b2264d4b000629e8e8b10a0bf3ca198f0c7",
      "estimated_tokens": 559,
      "observed_tokens": null,
      "selected_reason": "Real Resolve render QA result",
      "mandatory": true,
      "cacheable": true,
      "changed_since_previous_session": true,
      "used_in_decision": true,
      "used_in_patch": false,
      "duplicate_of": null,
      "stale": false,
      "trust_level": "NATIVE_EVIDENCE"
    },
    {
      "source_id": "consumer-task012-native-evidence",
      "source_type": "CONSUMER_NATIVE_EVIDENCE",
      "path_or_ref": "BAI_VIDEO_PRODUCTION:evidence/native/phase-g-task012-20260813-01/task012-native-cubase-final.json",
      "sha256": "sha256:2dd4c8f12d00566262d531800094ebce4d267f23e9520f05279e592e840a5735",
      "estimated_tokens": 257,
      "observed_tokens": null,
      "selected_reason": "Real Cubase round-trip result",
      "mandatory": true,
      "cacheable": true,
      "changed_since_previous_session": true,
      "used_in_decision": true,
      "used_in_patch": false,
      "duplicate_of": null,
      "stale": false,
      "trust_level": "NATIVE_EVIDENCE"
    },
    {
      "source_id": "consumer-task036-packaging-evidence",
      "source_type": "CONSUMER_NATIVE_EVIDENCE",
      "path_or_ref": "BAI_VIDEO_PRODUCTION:evidence/native/phase-g-task036-packaging-20260813-01/task036-w0-w1-evidence.json",
      "sha256": "sha256:9b78f42540e1ec89d7aeca5f6cd6da7ee468b8a4fb55be2624eb92126f3f3aec",
      "estimated_tokens": 647,
      "observed_tokens": null,
      "selected_reason": "Packaged shell partial gate and remaining gaps",
      "mandatory": true,
      "cacheable": true,
      "changed_since_previous_session": true,
      "used_in_decision": true,
      "used_in_patch": true,
      "duplicate_of": null,
      "stale": false,
      "trust_level": "NATIVE_EVIDENCE"
    },
    {
      "source_id": "consumer-regression-evidence",
      "source_type": "CONSUMER_REGRESSION_EVIDENCE",
      "path_or_ref": "BAI_VIDEO_PRODUCTION:evidence/native/phase-g-consumer-regression-20260813-01/phase-g-consumer-regression.json",
      "sha256": "sha256:27d2dee0271735c8085f0d68b40159b756b17b043cbb79137ce1253b1f2c7b83",
      "estimated_tokens": 321,
      "observed_tokens": null,
      "selected_reason": "Windows and WSL2 full regression result",
      "mandatory": true,
      "cacheable": true,
      "changed_since_previous_session": true,
      "used_in_decision": true,
      "used_in_patch": true,
      "duplicate_of": null,
      "stale": false,
      "trust_level": "VERIFIED_REGRESSION_EVIDENCE"
    }
  ],
  "usage": {
    "estimated_input_tokens": 24398,
    "observed_input_tokens": null,
    "observed_cached_input_tokens": null,
    "observed_output_tokens": null,
    "billed_tokens": null
  },
  "quality_gate": {
    "status": "PASS",
    "gate_id": "PHASE_G_NATIVE_CHECKPOINT_AND_RESTART_PASS"
  },
  "efficiency": {
    "status": "AVAILABLE",
    "score": 100,
    "formula": "useful_ratio*(1-duplicate_ratio)*(1-stale_ratio)*100"
  },
  "metrics": {
    "source_count": 11,
    "estimated_input_tokens": 24398,
    "duplicate_tokens": 0,
    "stale_tokens": 0,
    "useful_tokens": 24398,
    "avoidable_tokens": 0,
    "duplicate_ratio": 0,
    "stale_ratio": 0,
    "useful_ratio": 1,
    "avoidable_ratio": 0
  },
  "overfetch_policy": {
    "warning_ratio": 0.1,
    "major_ratio": 0.25,
    "critical_ratio": 0.5,
    "critical_repeat_count": 2
  },
  "repeated_overfetch_count": 0,
  "findings": [],
  "content_checksum": "sha256:0b8873e21555ba2c274c951ffb7add63d311ceb114ce757b91f9482274f2c930"
}
