{
  "context_cost_schema_version": "1.0.0",
  "record_id": "TASK-018-PHASE-G-W2-CONTEXT-CHECKPOINT-20260814-01",
  "task_id": "TASK-018",
  "session_id": "codex-phase-g-w2-20260814-root-01",
  "phase": "PHASE_G_TASK036_W2_CHECKPOINT",
  "recorded_at": "2026-08-13T16:43:09.019Z",
  "confidence": "CHARACTER_HEURISTIC",
  "sources": [
    {
      "source_id": "os-phase-g-context-baseline",
      "source_type": "CONTEXT_COST_RECORD",
      "path_or_ref": "tasks/TASK-018/phase-g-context-cost-baseline-2026-08-13.json",
      "sha256": "sha256:773820a2da57883fc4944f7ead77b5e48301d4ee9e800d61d30cc00a8ab0af39",
      "estimated_tokens": 4105,
      "observed_tokens": null,
      "selected_reason": "Phase G bootstrap comparison baseline",
      "mandatory": true,
      "cacheable": true,
      "changed_since_previous_session": false,
      "used_in_decision": true,
      "used_in_patch": true,
      "duplicate_of": null,
      "stale": false,
      "trust_level": "CURRENT_CANONICAL"
    },
    {
      "source_id": "os-phase-g-pilot-pr19",
      "source_type": "CONTEXT_COST_RECORD",
      "path_or_ref": "tasks/TASK-018/phase-g-pilot-context-cost-report-2026-08-13.json",
      "sha256": "sha256:94c094f90866fc83a0e7d80e6fe4bfd4e56287f299581540eb90fa52edfe5cb8",
      "estimated_tokens": 2221,
      "observed_tokens": null,
      "selected_reason": "Prior M3A checkpoint comparison record",
      "mandatory": true,
      "cacheable": true,
      "changed_since_previous_session": false,
      "used_in_decision": true,
      "used_in_patch": true,
      "duplicate_of": null,
      "stale": false,
      "trust_level": "CURRENT_CANONICAL"
    },
    {
      "source_id": "os-phase-g-restart-pr19",
      "source_type": "RESTART_EVIDENCE",
      "path_or_ref": "tasks/TASK-018/phase-g-conversation-free-restart-evidence-2026-08-13.md",
      "sha256": "sha256:4aa7ecc42e7e84953fba48b590027c73ecec9754be0927283c8a0cdd2ceb9da3",
      "estimated_tokens": 492,
      "observed_tokens": null,
      "selected_reason": "Establish that the prior fresh restart predates TASK-036 W2",
      "mandatory": true,
      "cacheable": true,
      "changed_since_previous_session": false,
      "used_in_decision": true,
      "used_in_patch": true,
      "duplicate_of": null,
      "stale": false,
      "trust_level": "CURRENT_CANONICAL"
    },
    {
      "source_id": "consumer-project",
      "source_type": "CONSUMER_CANONICAL_FILE",
      "path_or_ref": "BAI_VIDEO_PRODUCTION:PROJECT.md",
      "sha256": "sha256:219ddd9420525a710bbfd6582a3c66eb911f5091bc0e0c12989c9b4c8d7a0e2e",
      "estimated_tokens": 3482,
      "observed_tokens": null,
      "selected_reason": "Consumer product and release boundary at W2 HEAD",
      "mandatory": true,
      "cacheable": true,
      "changed_since_previous_session": true,
      "used_in_decision": true,
      "used_in_patch": true,
      "duplicate_of": null,
      "stale": false,
      "trust_level": "CONSUMER_HEAD_77A2CC9"
    },
    {
      "source_id": "consumer-current-state",
      "source_type": "CONSUMER_CANONICAL_FILE",
      "path_or_ref": "BAI_VIDEO_PRODUCTION:docs/ai-team/current-state.md",
      "sha256": "sha256:bbae2223f39eefc8150ae95bfa023630bea245734adec8a61f57ec419e71f418",
      "estimated_tokens": 3227,
      "observed_tokens": null,
      "selected_reason": "Current TASK-036 W2 and remaining closure boundary",
      "mandatory": true,
      "cacheable": true,
      "changed_since_previous_session": true,
      "used_in_decision": true,
      "used_in_patch": true,
      "duplicate_of": null,
      "stale": false,
      "trust_level": "CONSUMER_HEAD_77A2CC9"
    },
    {
      "source_id": "consumer-roadmap-ver-1-13",
      "source_type": "CONSUMER_CANONICAL_FILE",
      "path_or_ref": "BAI_VIDEO_PRODUCTION:docs/roadmap/PROJECT-ROADMAP-CANONICAL.md",
      "sha256": "sha256:4ffa929b56d59d961481a747e643e669781eff1e6b693b1dde073ad90290dae4",
      "estimated_tokens": 8186,
      "observed_tokens": null,
      "selected_reason": "Canonical Phase G continuation and merge order",
      "mandatory": true,
      "cacheable": true,
      "changed_since_previous_session": true,
      "used_in_decision": true,
      "used_in_patch": true,
      "duplicate_of": null,
      "stale": false,
      "trust_level": "CONSUMER_HEAD_77A2CC9"
    },
    {
      "source_id": "consumer-task036-native-report",
      "source_type": "CONSUMER_TASK_RECORD",
      "path_or_ref": "BAI_VIDEO_PRODUCTION:docs/ai-team/tasks/TASK-036/phase-g-native-acceptance-report.md",
      "sha256": "sha256:40fc19e347767adf05daab02b38315d6d95fc1b9d946e459b673aed14858ab2d",
      "estimated_tokens": 605,
      "observed_tokens": null,
      "selected_reason": "Exact W0/W1 partial and W2 pass boundary",
      "mandatory": true,
      "cacheable": true,
      "changed_since_previous_session": true,
      "used_in_decision": true,
      "used_in_patch": true,
      "duplicate_of": null,
      "stale": false,
      "trust_level": "CONSUMER_HEAD_77A2CC9"
    },
    {
      "source_id": "consumer-task036-w2-report",
      "source_type": "CONSUMER_TASK_RECORD",
      "path_or_ref": "BAI_VIDEO_PRODUCTION:docs/ai-team/tasks/TASK-036/phase-g-w2-runtime-binding-report.md",
      "sha256": "sha256:dcf5035ee7ffa6a3e3453647b35be3262cabc38f4f9ab57592345f629094e993",
      "estimated_tokens": 1232,
      "observed_tokens": null,
      "selected_reason": "Trusted packaged native W2 implementation and verification result",
      "mandatory": true,
      "cacheable": true,
      "changed_since_previous_session": true,
      "used_in_decision": true,
      "used_in_patch": true,
      "duplicate_of": null,
      "stale": false,
      "trust_level": "CONSUMER_HEAD_77A2CC9"
    },
    {
      "source_id": "consumer-task036-w2-evidence",
      "source_type": "CONSUMER_NATIVE_EVIDENCE",
      "path_or_ref": "BAI_VIDEO_PRODUCTION:evidence/native/phase-g-task036-w2-runtime-20260813-01/task036-w2-packaged-native-e2e.json",
      "sha256": "sha256:eeb7f233541e772b77646a5ac29690fe88e80bc72460893f4cfff98807ac39f9",
      "estimated_tokens": 665,
      "observed_tokens": null,
      "selected_reason": "Machine-readable packaged native W2 PASS Evidence",
      "mandatory": true,
      "cacheable": true,
      "changed_since_previous_session": true,
      "used_in_decision": true,
      "used_in_patch": true,
      "duplicate_of": null,
      "stale": false,
      "trust_level": "NATIVE_EVIDENCE_HEAD_77A2CC9"
    }
  ],
  "usage": {
    "estimated_input_tokens": 24215,
    "observed_input_tokens": null,
    "observed_cached_input_tokens": null,
    "observed_output_tokens": null,
    "billed_tokens": null
  },
  "quality_gate": {
    "status": "PASS",
    "gate_id": "PHASE_G_W2_CONTEXT_ACCOUNTING_PASS"
  },
  "efficiency": {
    "status": "AVAILABLE",
    "score": 100,
    "formula": "useful_ratio*(1-duplicate_ratio)*(1-stale_ratio)*100"
  },
  "metrics": {
    "source_count": 9,
    "estimated_input_tokens": 24215,
    "duplicate_tokens": 0,
    "stale_tokens": 0,
    "useful_tokens": 24215,
    "avoidable_tokens": 0,
    "duplicate_ratio": 0,
    "stale_ratio": 0,
    "useful_ratio": 1,
    "avoidable_ratio": 0
  },
  "overfetch_policy": {
    "warning_ratio": 0.1,
    "major_ratio": 0.25,
    "critical_ratio": 0.5,
    "critical_repeat_count": 2
  },
  "repeated_overfetch_count": 0,
  "findings": [],
  "content_checksum": "sha256:3f007d815bc6be6dcbcc4d0a878178aef0cd69ebf70dbbaccad68ad5b3e7838f"
}
